{
  "protocol": "warp:0.1.0",
  "name": "Create Token",
  "title": "Create a fungible token (ESDT).",
  "description": "The fungible token will be created on the MultiversX blockchain.",
  "preview": "https://vleap.io/images/external/warps/multiversx-docs.jpg",
  "actions": [
    {
      "type": "contract",
      "label": "Create now",
      "address": "erd1qqqqqqqqqqqqqqqpqqqqqqqqqqqqqqqqqqqqqqqqqqqqqqqzllls8a5w6u",
      "func": "issue",
      "args": [],
      "value": "50000000000000000",
      "gasLimit": 60000000,
      "inputs": [
        {
          "name": "name",
          "type": "string",
          "position": "arg:1",
          "source": "query",
          "required": true,
          "min": 3,
          "max": 50,
          "pattern": "^[a-zA-Z0-9]+$",
          "patternDescription": "Only letters and numbers are allowed."
        },
        {
          "name": "ticker",
          "type": "string",
          "position": "arg:2",
          "source": "query",
          "required": true,
          "min": 3,
          "max": 10,
          "pattern": "^[A-Z0-9]+$",
          "patternDescription": "Only uppercase letters and numbers are allowed."
        },
        {
          "name": "supply",
          "type": "biguint",
          "position": "arg:3",
          "source": "query",
          "required": true,
          "modifier": "scale:decimals"
        },
        {
          "name": "decimals",
          "type": "uint8",
          "position": "arg:4",
          "source": "query",
          "required": true,
          "min": 0,
          "max": 18
        }
      ]
    },
    {
      "type": "link",
      "label": "Read docs",
      "description": "Find more information about ESDT.",
      "url": "https://docs.multiversx.com/tokens/fungible-tokens"
    }
  ]
}
