{
  "protocol": "warp:0.2.0",
  "name": "Raffle: Get Participants",
  "title": "Get Participants",
  "description": "<p>Get the participants of the raffle sent to you. ID: {{RAFFLE_ID}}</p>",
  "preview": "https://vleap.io/images/external/warps/raffle-participate.jpg",
  "vars": {
    "RAFFLE_ID": "query:raffle"
  },
  "actions": [
    {
      "type": "query",
      "label": "Get Participants",
      "address": "erd1qqqqqqqqqqqqqpgqht0nht73ewg4mxr8nd89v5p8cfryjjlfl3tskqtqpw",
      "func": "getParticipations",
      "args": ["uint64:{{RAFFLE_ID}}"],
      "abi": "hash:779a71a57507759eb4aca42a34e513f140d77e8711fb681ede142c1cb037c257"
    }
  ]
}
