{
  "protocol": "warp:0.1.0",
  "name": "Stake Egld",
  "title": "Ready to stake EGLD with us?",
  "description": "Stake with us to enable extra benefits across all our platforms.",
  "preview": "https://cdn.prod.website-files.com/6597cc7be68d63ec0c8ce33f/660441460ae47e18853dd348_staking-v4.webp",
  "actions": [
    {
      "type": "contract",
      "label": "Stake now",
      "address": "erd1qqqqqqqqqqqqqqqpqqqqqqqqqqqqqqqqqqqqqqqqqqqqqplllllscktaww",
      "func": "delegate",
      "args": [],
      "gasLimit": 10000000,
      "inputs": [
        {
          "name": "value",
          "description": "Amount of eGold to delegate.",
          "type": "biguint",
          "position": "value",
          "source": "field",
          "required": true,
          "min": 1,
          "modifier": "scale:18"
        }
      ]
    },
    {
      "type": "link",
      "label": "Learn more",
      "description": "Find more information about staking eGold.",
      "url": "https://multiversx.com/egld"
    }
  ]
}
