{
  "protocol": "warp:0.1.0",
  "name": "Unfreeze Token",
  "title": "Unfreeze the tokens owned by an account.",
  "description": "The manager of an ESDT token may unfreeze the tokens held by a specific Account. As a consequence, the tokens may be transferred to or from the frozen Account.",
  "preview": "https://vleap.io/images/external/warps/multiversx-docs.jpg",
  "actions": [
    {
      "type": "contract",
      "label": "Unfreeze now",
      "address": "erd1qqqqqqqqqqqqqqqpqqqqqqqqqqqqqqqqqqqqqqqqqqqqqqqzllls8a5w6u",
      "func": "unFreeze",
      "args": [],
      "gasLimit": 60000000,
      "inputs": [
        {
          "name": "Token Identifier",
          "type": "string",
          "position": "arg:1",
          "source": "field",
          "required": true
        },
        {
          "name": "Account Address",
          "type": "address",
          "position": "arg:2",
          "source": "field",
          "required": true
        }
      ]
    },
    {
      "type": "link",
      "label": "Read docs",
      "description": "Find more information about the ESDT standard.",
      "url": "https://docs.multiversx.com/tokens/fungible-tokens"
    }
  ]
}
