{
  "protocol": "warp:0.4.0",
  "name": "Entity: Propose",
  "title": "Propose an Entity",
  "description": "Propose an entity to the community.",
  "preview": "https://peerme.io/images/external/warps/entity-propose-preview.jpg",
  "vars": {
    "REQUIRED_AMOUNT": "query:amount"
  },
  "actions": [
    {
      "type": "contract",
      "label": "Burn for Tag now",
      "address": "erd1qqqqqqqqqqqqqpgq4kns8he9r84c58ed3jjuam3tp7u9zl4n27rsy2kv6u",
      "func": "burnForTrust",
      "args": [],
      "gasLimit": 20000000,
      "inputs": [
        {
          "name": "SUPER to burn",
          "type": "esdt",
          "position": "transfer",
          "source": "field",
          "required": true,
          "options": ["SUPER-507aa6"],
          "min": "{{REQUIRED_AMOUNT}}"
        }
      ]
    },
    {
      "type": "link",
      "label": "View Tags",
      "description": "View details of PeerTags.",
      "url": "https://peerme.io/peer-tags"
    }
  ],
  "next": "https://tally.so/r/w4PvNk"
}
